name,yoga_type,yoga_level,date,duration,trainer,description
Rise and Shine Yoga,,,6-Apr-22,50,Georgia,Start
Lunchtime Stretch,Hot,Advanced,10-Apr-22,50,Sebastian Niki,"Take a lunchtime break to loosen up! Bring a mat, a towel, and some water!"
After Work Workout,Yin,Intermediate,12-Apr-22,60,Erik Ayla,Finish your day with a stress reliving session! Bring a mat and a towel!
Late Night Relax,Hatha,Beginner,20-Apr-22,50,Steven Jones,Close out your day with a relaxing class of yoga! Bring a mat!
Yoga Time,Hot,Beginner,30-Apr-22,75,John Doe,Join us for some relaxing yoga! Bring a towel and a mat!
